{
 "version": "0.1",
 "persona": "example",
 "placeholder": true,
 "provenance": {
  "everything": "placeholder for integration; replaced by the fitted persona files"
 },
 "app_category_map": {
  "com.instagram.android": "social",
  "com.snapchat.android": "social",
  "com.linkedin.android": "social",
  "com.google.android.youtube": "short_video",
  "com.whatsapp": "messaging",
  "org.telegram.messenger": "messaging",
  "com.google.android.apps.messaging": "messaging",
  "com.samsung.android.messaging": "messaging",
  "in.swiggy.android": "shopping_promo",
  "com.application.zomato": "shopping_promo",
  "com.flipkart.android": "shopping_promo",
  "in.amazon.mShop.android.shopping": "shopping_promo",
  "com.myntra.android": "shopping_promo",
  "com.nis.app": "news",
  "com.google.android.gm": "work_email",
  "com.microsoft.office.outlook": "work_email",
  "com.Slack": "work_email"
 },
 "pull": {
  "global": {
   "m_g": 0.22,
   "n_g": 20
  },
  "category": {
   "short_video": {
    "r_c": 1.8,
    "mu_c0": 2.5,
    "sigma_c": 0.9
   },
   "social": {
    "r_c": 1.6,
    "mu_c0": 2.1,
    "sigma_c": 0.8
   },
   "messaging": {
    "r_c": 1.4,
    "mu_c0": 1.2,
    "sigma_c": 0.7
   },
   "shopping_promo": {
    "r_c": 0.6,
    "mu_c0": 1.0,
    "sigma_c": 0.7
   },
   "news": {
    "r_c": 0.8,
    "mu_c0": 1.3,
    "sigma_c": 0.7
   },
   "work_email": {
    "r_c": 1.1,
    "mu_c0": 1.5,
    "sigma_c": 0.6
   },
   "other": {
    "r_c": 0.7,
    "mu_c0": 1.0,
    "sigma_c": 0.8
   }
  },
  "state": {
   "FREE": {
    "r_s": 1.0,
    "delta_s": 0.0
   },
   "FOCUS_STEADY": {
    "r_s": 0.8,
    "delta_s": 0.0
   },
   "FOCUS_RESTLESS": {
    "r_s": 1.3,
    "delta_s": 0.2
   }
  },
  "prior_weights": {
   "category": 10,
   "cell_base": 5,
   "cell_pool": 0.25,
   "cell_pool_cap": 40,
   "mu_category": 8,
   "mu_cell": 4,
   "sigma": 8
  }
 },
 "worth": {
  "bias": -1.5,
  "weights": {
   "is_conversation": 1.6,
   "cat_messaging": 0.8,
   "cat_work_email": 1.2,
   "priority_conversation": 2.0,
   "group_chat": -0.9,
   "cat_shopping_promo": -1.8,
   "cat_social_nonconversation": -1.4,
   "cat_short_video": -1.6,
   "bait_hit": -1.2,
   "urgency_hit_in_conversation": 1.5,
   "same_sender_repeat": 0.9
  },
  "k_app": 20,
  "k_sender": 6
 },
 "policy": {
  "lambda": 2.0,
  "w": 0.5,
  "pi_star": 0.7,
  "epsilon": 0.1,
  "cap_min": 45,
  "c_glance": 0.5,
  "open_window_min": 10,
  "idle_min": 2,
  "minutes_lost_cap_min": 60,
  "minutes_floor_min": 0.1,
  "might_matter_upper80": 0.5,
  "explore_upper80": 0.3,
  "upper80_z": 0.84,
  "low_confidence_width": 0.4,
  "repeat_ping": {
   "count": 3,
   "window_min": 3
  },
  "cap_by_kind": {
   "direct": 15,
   "group": 30,
   "email": 30,
   "social": 45,
   "promo": 45
  }
 },
 "demo_learning": {
  "k_app": 4,
  "k_sender": 2,
  "prior_weights": {
   "category": 3,
   "cell_base": 2,
   "mu_category": 3,
   "mu_cell": 2
  }
 },
 "never_hold": {
  "android_categories": [
   "call",
   "alarm",
   "navigation",
   "transport",
   "stopwatch"
  ],
  "packages": [
   "com.google.android.apps.maps",
   "com.ubercab",
   "com.olacabs.customer",
   "com.rapido.passenger"
  ],
  "otp_source_packages": [
   "com.google.android.apps.messaging",
   "com.samsung.android.messaging",
   "com.whatsapp",
   "com.google.android.apps.nbu.paisa.user",
   "com.phonepe.app",
   "net.one97.paytm"
  ]
 },
 "features": {
  "pause_card": false
 },
 "contexts": [
  {
   "id": "placements",
   "label": "Placements",
   "active": true,
   "phrases": [
    "placement",
    "placements",
    "placement drive",
    "campus drive",
    "drive",
    "registration",
    "register by",
    "last date",
    "shortlist",
    "shortlisted",
    "interview",
    "aptitude test",
    "pre-placement talk",
    "offer letter"
   ]
  }
 ],
 "lexicons": {
  "urgency": [
   "urgent",
   "emergency",
   "asap",
   "call me",
   "call back",
   "pick up",
   "pick the phone",
   "right now",
   "immediately",
   "hospital",
   "admitted",
   "accident",
   "help me",
   "not well",
   "come home",
   "where are you",
   "jaldi",
   "turant",
   "zaroori",
   "zaruri",
   "abhi call",
   "abhi aa",
   "call kar",
   "phone utha",
   "phone uthao",
   "kahan ho",
   "ghar aa",
   "tabiyat"
  ],
  "bait": [
   "liked your",
   "commented on",
   "mentioned you",
   "tagged you",
   "started following",
   "viewed your",
   "new followers",
   "is live",
   "live now",
   "just posted",
   "watch now",
   "trending",
   "you won't believe",
   "% off",
   "cashback",
   "coupon",
   "free delivery",
   "don't miss",
   "dont miss",
   "last chance",
   "limited time",
   "offer ends",
   "special offer",
   "deal of the day",
   "sale is live",
   "sale ends",
   "flash sale",
   "miss mat karo",
   "sirf aaj",
   "abhi dekho",
   "offer khatam"
  ],
  "otp_keywords": [
   "otp",
   "one time password",
   "one-time password",
   "verification code",
   "security code",
   "login code",
   "passcode",
   "is your code"
  ]
 },
 "draw_bank": [
  [
   -0.793122,
   0.240571,
   -1.896326
  ],
  [
   1.395772,
   0.638295,
   -0.292047
  ],
  [
   -0.311949,
   0.303835,
   -0.26766
  ],
  [
   -0.225909,
   0.720068,
   0.514705
  ],
  [
   -0.064128,
   -0.085477,
   0.160916
  ],
  [
   -0.614018,
   -0.40375,
   0.54826
  ],
  [
   -0.130483,
   -1.374426,
   -0.477279
  ],
  [
   0.656622,
   -0.232283,
   -0.148733
  ],
  [
   0.641837,
   1.82461,
   -0.713189
  ],
  [
   1.348207,
   -1.230013,
   0.174978
  ],
  [
   -1.16953,
   1.351458,
   0.833923
  ],
  [
   1.137717,
   -0.885533,
   0.684555
  ],
  [
   -0.519013,
   -0.457385,
   0.506537
  ],
  [
   0.876718,
   0.20442,
   -0.627987
  ],
  [
   -0.825817,
   1.444317,
   0.593946
  ],
  [
   0.719728,
   2.183488,
   -0.815863
  ],
  [
   2.559458,
   3.150908,
   1.618413
  ],
  [
   0.827107,
   -0.663822,
   0.994486
  ],
  [
   -0.442692,
   -0.021651,
   -0.290433
  ],
  [
   0.28383,
   1.288078,
   -0.555584
  ],
  [
   -0.985404,
   -1.002957,
   -0.968277
  ],
  [
   -1.431103,
   -0.912934,
   1.293266
  ],
  [
   -0.593312,
   0.257108,
   -1.216894
  ],
  [
   0.169651,
   -1.740781,
   -0.698756
  ],
  [
   2.254539,
   -0.58297,
   1.119976
  ],
  [
   0.455054,
   -0.152986,
   -0.652107
  ],
  [
   1.286909,
   -0.177383,
   1.527424
  ],
  [
   -0.719079,
   0.057339,
   0.465499
  ],
  [
   0.37316,
   -1.233802,
   -0.664063
  ],
  [
   -0.19598,
   -0.853699,
   0.677325
  ],
  [
   0.588019,
   -1.957084,
   -1.805254
  ],
  [
   -1.281563,
   0.11726,
   2.033173
  ],
  [
   -0.382356,
   0.250651,
   -1.063112
  ],
  [
   -1.046836,
   -1.957228,
   -0.028344
  ],
  [
   0.947217,
   -0.356714,
   1.396453
  ],
  [
   0.197855,
   -0.036412,
   0.517254
  ],
  [
   0.487378,
   1.147806,
   -0.801954
  ],
  [
   -2.288049,
   0.114747,
   -0.611675
  ],
  [
   -0.027177,
   1.6643,
   -1.102842
  ],
  [
   0.764797,
   0.945868,
   0.460736
  ],
  [
   1.118508,
   -0.458362,
   -0.68151
  ],
  [
   1.038983,
   0.7203,
   1.390378
  ],
  [
   0.21229,
   1.623563,
   -0.28208
  ],
  [
   -1.060329,
   -2.037089,
   -1.101401
  ],
  [
   0.818504,
   -1.464929,
   -0.452364
  ],
  [
   2.106584,
   0.846796,
   1.790985
  ],
  [
   -0.991562,
   -2.459975,
   1.516381
  ],
  [
   -1.416943,
   0.090924,
   0.217093
  ],
  [
   -0.948896,
   1.552633,
   1.549338
  ],
  [
   0.551444,
   -0.029491,
   0.191437
  ],
  [
   -1.095908,
   -0.239064,
   -0.104933
  ],
  [
   -0.852233,
   0.849215,
   -1.426481
  ],
  [
   -0.453419,
   -2.252878,
   0.496819
  ],
  [
   0.742605,
   0.621292,
   2.918087
  ],
  [
   0.939791,
   -0.941991,
   2.66354
  ],
  [
   -0.920318,
   0.788739,
   0.743128
  ],
  [
   -0.879723,
   1.395349,
   0.354594
  ],
  [
   0.570955,
   -0.675733,
   1.302633
  ],
  [
   -0.860938,
   -1.779159,
   1.425127
  ],
  [
   -0.426729,
   0.04337,
   1.922757
  ],
  [
   1.136491,
   0.632709,
   1.069914
  ],
  [
   -0.727509,
   0.753089,
   1.109937
  ],
  [
   0.755422,
   -0.204135,
   -3.747414
  ],
  [
   0.557303,
   0.114876,
   -0.369554
  ],
  [
   0.778099,
   0.265703,
   0.203956
  ],
  [
   -1.483591,
   -1.459323,
   0.370536
  ],
  [
   0.076057,
   0.138741,
   0.166263
  ],
  [
   0.411456,
   0.036066,
   0.157771
  ],
  [
   0.256114,
   0.92941,
   -0.514689
  ],
  [
   0.786396,
   0.636383,
   0.105402
  ],
  [
   -0.475112,
   0.36914,
   0.863973
  ],
  [
   -1.074978,
   0.062146,
   0.064744
  ],
  [
   -0.661202,
   -0.619288,
   -1.551147
  ],
  [
   -1.103127,
   -1.537477,
   -0.616572
  ],
  [
   -0.559986,
   -0.541285,
   0.371843
  ],
  [
   -0.187567,
   -0.728913,
   -0.721883
  ],
  [
   -1.13151,
   -0.196168,
   -0.214055
  ],
  [
   1.622958,
   1.534152,
   1.477902
  ],
  [
   2.079242,
   -1.217068,
   0.672984
  ],
  [
   0.761053,
   0.476216,
   2.126671
  ],
  [
   2.537875,
   0.979367,
   0.653146
  ],
  [
   -1.122398,
   -1.120359,
   0.700223
  ],
  [
   -0.075633,
   -1.330561,
   -0.124024
  ],
  [
   0.360008,
   0.935927,
   -0.107679
  ],
  [
   -0.269217,
   0.006208,
   0.172983
  ],
  [
   -1.163133,
   0.833308,
   2.190326
  ],
  [
   0.8142,
   -1.448198,
   0.094509
  ],
  [
   -1.765628,
   -1.829212,
   0.659251
  ],
  [
   0.077649,
   -0.68711,
   -2.087447
  ],
  [
   -1.268932,
   0.162196,
   0.031894
  ],
  [
   0.6897,
   1.523395,
   -0.339257
  ],
  [
   0.468967,
   -0.137798,
   -0.49654
  ],
  [
   -0.244791,
   0.960753,
   -1.028419
  ],
  [
   1.141038,
   1.477287,
   0.035733
  ],
  [
   0.254918,
   -1.411799,
   2.360535
  ],
  [
   0.978886,
   0.172276,
   0.057438
  ],
  [
   0.450972,
   -0.651236,
   0.283262
  ],
  [
   -0.923577,
   0.49732,
   -0.678213
  ],
  [
   0.895518,
   -0.120369,
   0.268746
  ],
  [
   2.960888,
   0.804233,
   0.2678
  ],
  [
   0.044389,
   -1.039162,
   1.084221
  ],
  [
   1.602339,
   0.064355,
   1.676752
  ],
  [
   -0.112278,
   -1.773054,
   -0.653238
  ],
  [
   -1.056992,